{
  "schema_id": "naturalcontrol.lifecycle_result.v1",
  "spec_version": "1.0",
  "epoch_ns": "1742010000025000000",
  "request_id": "req-click-001",
  "interaction_id": "interaction-press-release-001",
  "execution_id": "exec-001",
  "trace_id": "trace-001",
  "terminal_state": "succeeded",
  "summary": "interaction completed successfully",
  "artifacts": {
    "trace_pack_ref": "samples/naturalcontrol.interaction_trace_pack.v1.2/minimal.json"
  }
}
